{
	"name": "CustomRec",
	"package": "com.boozallen.aiops.mda.pattern.record",
	"description": "Example custom record for Spark Java Data Delivery Patterns",
	"fields": [
		{
			"name": "customField",
			"type": {
				"name": "customType",
				"package": "com.boozallen.aiops.mda.pattern.dictionary"
			}
		},
		{
			"name": "binaryField",
			"type": {
				"name": "binarydata",
				"package": "com.boozallen.aiops.mda.pattern.dictionary"
			}
		}
	]
}
