{
	"name": "RecordWithValidation",
	"package": "com.boozallen.aiops.mda.pattern.record",
	"description": "Example record with fields that require validation",
	"fields": [
		{
			"name": "stringValidation",
			"type": {
				"name": "stringWithValidation",
				"package": "com.boozallen.aiops.mda.pattern.dictionary"
			},
			"column": "str_v8n"
		},
		{
			"name": "integerValidation",
			"type": {
				"name": "integerWithValidation",
				"package": "com.boozallen.aiops.mda.pattern.dictionary"
			},
			"column": "int_v8n"
		},
		{
			"name": "decimalValidation",
			"type": {
				"name": "decimalWithValidation",
				"package": "com.boozallen.aiops.mda.pattern.dictionary"
			},
			"column": "dec_v8n"
		},
		{
			"name": "floatValidation",
			"type": {
				"name": "floatWithValidation",
				"package": "com.boozallen.aiops.mda.pattern.dictionary"
			},
			"column": "float_v8n"
		},
		{
			"name": "requiredSimpleType",
			"type": {
				"name": "customType",
				"package": "com.boozallen.aiops.mda.pattern.dictionary"
			},
			"column": "simple_v8n",
			"required": true
		},
		{
			"name": "requiredComplexType",
			"type": {
				"name": "stringWithValidation",
				"package": "com.boozallen.aiops.mda.pattern.dictionary"
			},
			"column": "complex_v8n",
			"required": true
		}
	]
}
